{"hypothesis":"In click 8.3.0, Parameter.handle_parse_result (test-repos/click/src/click/core.py:2536-2551) commits a value to ctx.params[self.name] for the first parameter that targets a given name, regardless of whether that parameter actually contributed a value. The guard `self.name not in ctx.params` causes the first-processed option to claim the shared destination, and the next line `ctx.params[self.name] = value if value is not UNSET else None` writes None when the option had no CLI value, env value, default_map value, and self.default is UNSET. For feature flags declared with flag_value= (e.g. --red, --blue), self.default stays UNSET unless the user passed default=True. Only --green has default=True, which Option.__init__ aligns to flag_value (\"green\") at core.py:2771-2772; siblings keep default=UNSET. With declaration order --red, --green, --blue, click processes --red first, writes None into ctx.params[\"color\"], and the guard blocks --green from contributing its \"green\" default. Moving --green above --red lets --green claim the slot first with \"green\", which is why reordering fixes the output.","confidence":0.88,"files_examined":["test-repos/click/src/click/core.py"],"call_chain":["test-repos/click/src/click/core.py:Parameter.handle_parse_result()","test-repos/click/src/click/core.py:Parameter.consume_value()","test-repos/click/src/click/core.py:Option.__init__()"],"affected_files":["test-repos/click/src/click/core.py"],"supporting_evidence":[{"type":"code","path":"test-repos/click/src/click/core.py","lines":"2536-2551","note":"Parameter.handle_parse_result: guard `self.name not in ctx.params` enforces first-touch wins; line 2551 writes `value if value is not UNSET else None`, converting a non-contribution into None inside the just-claimed slot"},{"type":"code","path":"test-repos/click/src/click/core.py","lines":"2295-2322","note":"Parameter.consume_value returns UNSET when no CLI input, env, default_map, and self.default is UNSET"},{"type":"code","path":"test-repos/click/src/click/core.py","lines":"2761-2772","note":"Option.__init__: `if self.default is True and self.flag_value is not UNSET: self.default = self.flag_value` — only --green (default=True) gets default aligned to flag_value; --red/--blue keep default=UNSET"},{"type":"code","path":"test-repos/click/src/click/core.py","lines":"2541","note":"`and self.name not in ctx.params` — first-touch wins semantics for shared-name parameters"},{"type":"code","path":"test-repos/click/src/click/core.py","lines":"2551","note":"`ctx.params[self.name] = value if value is not UNSET else None` writes None for a non-contributing option that won the first-touch race"},{"type":"trace","path":"test-repos/click/src/click/core.py","lines":"2536-2551","note":"Manual trace reproduces both reported outputs: order red,green,blue → ctx.params[\"color\"] set to None by --red, locking out --green → None; order green,red,blue → --green claims first with \"green\" → \"green\""}],"rejected_hypotheses":[{"id":"h_consume_value_regression","reason":"consume_value returns (\"green\", DEFAULT) for --green in isolation because core.py:2771-2772 sets self.default = self.flag_value when default is True; order-sensitivity only manifests when a sibling processed earlier has already written to ctx.params[name], so the regression is in the shared-name write guard in handle_parse_result, not per-option default resolution"}],"unknowns":["exact commit SHA in click 8.3.0 that introduced the guard/write at core.py:2536-2551","whether 8.2.x had a different write path that avoided the UNSET→None pre-emption"],"introducing_commit":null,"next_best_action":"In Parameter.handle_parse_result (test-repos/click/src/click/core.py:2536-2551), tighten the guard to also require `value is not UNSET` before writing ctx.params[self.name], then add a post-pass `ctx.params.setdefault(param.name, None)` for each declared exposed param to fill in still-missing names."}
